{
  "$schema": "https://json-schema.org/draft/2020-12/schema",
  "$id": "https://sovrain.ai/sis/v1/schema.json",
  "title": "Sovrain Intent Spec (SIS) v1.0.0",
  "description": "Canonical machine-readable specification for expressing decision-ready intent before execution.",
  "type": "object",
  "additionalProperties": false,
  "required": [
    "intent_id",
    "schema_version",
    "intent_type",
    "created_at",
    "source",
    "objective",
    "actions",
    "constraints",
    "context"
  ],
  "properties": {
    "intent_id": {
      "type": "string",
      "format": "uuid",
      "description": "Globally unique identifier for the intent object."
    },
    "schema_version": {
      "type": "string",
      "pattern": "^1\\.0\\.0$",
      "description": "SIS schema version."
    },
    "intent_type": {
      "type": "string",
      "minLength": 1,
      "description": "Classification of the intent object.",
      "examples": [
        "offer_decision",
        "workflow_decision",
        "agent_action",
        "recommendation"
      ]
    },
    "created_at": {
      "type": "string",
      "format": "date-time",
      "description": "Timestamp when the intent object was created."
    },
    "source": {
      "$ref": "#/$defs/source"
    },
    "objective": {
      "$ref": "#/$defs/objective"
    },
    "actions": {
      "type": "array",
      "minItems": 1,
      "items": {
        "$ref": "#/$defs/action"
      },
      "description": "Candidate actions to be evaluated by an implementation or processor."
    },
    "constraints": {
      "type": "array",
      "minItems": 1,
      "items": {
        "$ref": "#/$defs/constraint"
      },
      "description": "Constraints that must be evaluated prior to execution."
    },
    "context": {
      "$ref": "#/$defs/context"
    },
    "evaluation_hints": {
      "$ref": "#/$defs/evaluation_hints"
    },
    "evidence": {
      "type": "array",
      "items": {
        "$ref": "#/$defs/evidence_item"
      },
      "default": [],
      "description": "Optional traceability or explainability references."
    },
    "extensions": {
      "type": "object",
      "default": {},
      "description": "Optional namespaced extension container. Core schema must remain valid.",
      "propertyNames": {
        "type": "string",
        "minLength": 1
      },
      "additionalProperties": true
    }
  },
  "$defs": {
    "source": {
      "type": "object",
      "additionalProperties": false,
      "required": [
        "system"
      ],
      "properties": {
        "system": {
          "type": "string",
          "minLength": 1,
          "description": "Originating system name."
        },
        "source_ref": {
          "type": "string",
          "description": "Source-system reference identifier."
        },
        "correlation_id": {
          "type": "string",
          "description": "Correlation identifier for distributed tracing."
        }
      }
    },
    "objective": {
      "type": "object",
      "additionalProperties": false,
      "required": [
        "title",
        "success_metric"
      ],
      "properties": {
        "objective_id": {
          "type": "string",
          "format": "uuid",
          "description": "Optional unique identifier for the objective."
        },
        "title": {
          "type": "string",
          "minLength": 1,
          "description": "Human-readable objective name."
        },
        "objective_type": {
          "type": "string",
          "description": "Optional objective category.",
          "examples": [
            "growth",
            "risk",
            "retention",
            "compliance",
            "efficiency"
          ]
        },
        "success_metric": {
          "type": "string",
          "minLength": 1,
          "description": "Metric used to evaluate success."
        },
        "target": {
          "type": "string",
          "description": "Optional target expression."
        },
        "priority": {
          "type": "number",
          "description": "Optional numeric priority."
        },
        "time_horizon": {
          "type": "string",
          "description": "Optional decision horizon."
        }
      }
    },
    "action": {
      "type": "object",
      "additionalProperties": false,
      "required": [
        "action_id",
        "action_type"
      ],
      "properties": {
        "action_id": {
          "type": "string",
          "format": "uuid",
          "description": "Unique identifier for the action."
        },
        "action_type": {
          "type": "string",
          "minLength": 1,
          "description": "Type of candidate action.",
          "examples": [
            "show_offer",
            "suppress_offer",
            "recommend_action",
            "defer_decision",
            "request_human_review"
          ]
        },
        "action_ref": {
          "type": "string",
          "description": "Reference to an external action or candidate object."
        },
        "channels": {
          "type": "array",
          "items": {
            "type": "string"
          },
          "default": [],
          "description": "Channels in which the action may apply."
        },
        "priority_hint": {
          "type": "number",
          "description": "Optional upstream ranking hint."
        },
        "justification": {
          "type": "string",
          "description": "Optional rationale supplied by the originating system."
        }
      }
    },
    "constraint": {
      "type": "object",
      "additionalProperties": false,
      "required": [
        "type",
        "rule",
        "severity",
        "scope"
      ],
      "properties": {
        "constraint_id": {
          "type": "string",
          "format": "uuid",
          "description": "Optional unique identifier for the constraint."
        },
        "type": {
          "type": "string",
          "minLength": 1,
          "description": "Constraint category.",
          "examples": [
            "eligibility",
            "compliance",
            "frequency",
            "budget",
            "risk",
            "time",
            "channel"
          ]
        },
        "rule": {
          "type": "string",
          "minLength": 1,
          "description": "Machine-readable or human-readable rule expression."
        },
        "severity": {
          "type": "string",
          "enum": [
            "block",
            "warn"
          ],
          "description": "Constraint severity."
        },
        "scope": {
          "type": "string",
          "enum": [
            "intent",
            "action"
          ],
          "description": "Scope at which the constraint applies."
        }
      }
    },
    "context": {
      "type": "object",
      "additionalProperties": false,
      "required": [
        "trigger"
      ],
      "properties": {
        "customer_ref": {
          "type": "string",
          "description": "Optional customer or subject reference."
        },
        "segment_ref": {
          "type": "string",
          "description": "Optional segment reference."
        },
        "trigger": {
          "$ref": "#/$defs/trigger"
        },
        "channel_context": {
          "type": "array",
          "items": {
            "type": "string"
          },
          "default": [],
          "description": "Channels relevant to the current decision context."
        },
        "session_ref": {
          "type": "string",
          "description": "Optional session identifier."
        },
        "attributes": {
          "type": "object",
          "default": {},
          "additionalProperties": true,
          "description": "Arbitrary contextual attributes."
        }
      }
    },
    "trigger": {
      "type": "object",
      "additionalProperties": false,
      "required": [
        "type"
      ],
      "properties": {
        "type": {
          "type": "string",
          "minLength": 1,
          "description": "Trigger type."
        },
        "timestamp": {
          "type": "string",
          "format": "date-time",
          "description": "Optional trigger timestamp."
        }
      }
    },
    "evaluation_hints": {
      "type": "object",
      "additionalProperties": false,
      "description": "Optional advisory inputs for downstream evaluators or processors.",
      "properties": {
        "confidence_input": {
          "type": "number",
          "minimum": 0,
          "maximum": 1,
          "description": "Optional input confidence score."
        },
        "priority_model": {
          "type": "string",
          "description": "Optional identifier for the upstream prioritization or ranking model."
        },
        "review_recommended": {
          "type": "boolean",
          "description": "Optional advisory signal indicating review may be useful."
        }
      }
    },
    "evidence_item": {
      "type": "object",
      "additionalProperties": false,
      "required": [
        "type",
        "ref"
      ],
      "properties": {
        "type": {
          "type": "string",
          "minLength": 1,
          "description": "Evidence type."
        },
        "ref": {
          "type": "string",
          "minLength": 1,
          "description": "Evidence reference."
        }
      }
    }
  },
  "examples": [
    {
      "intent_id": "550e8400-e29b-41d4-a716-446655440000",
      "schema_version": "1.0.0",
      "intent_type": "offer_decision",
      "created_at": "2026-03-17T18:42:00Z",
      "source": {
        "system": "manymoves",
        "source_ref": "mobile_offer_request",
        "correlation_id": "corr_789"
      },
      "objective": {
        "objective_id": "123e4567-e89b-12d3-a456-426614174000",
        "title": "Increase refinance conversions",
        "objective_type": "growth",
        "success_metric": "conversion_rate",
        "target": "+10%",
        "priority": 1,
        "time_horizon": "30d"
      },
      "actions": [
        {
          "action_id": "a987fbc9-4bed-3078-cf07-9141ba07c9f3",
          "action_type": "show_offer",
          "action_ref": "refi_offer_candidate_001",
          "channels": [
            "in_app"
          ],
          "priority_hint": 0.8,
          "justification": "Prequalified member with recent rate-check behavior"
        }
      ],
      "constraints": [
        {
          "constraint_id": "7c9e6679-7425-40de-944b-e07fc1f90ae7",
          "type": "eligibility",
          "rule": "credit_score > 680",
          "severity": "block",
          "scope": "action"
        }
      ],
      "context": {
        "customer_ref": "123",
        "segment_ref": "student_refi",
        "trigger": {
          "type": "mobile_login",
          "timestamp": "2026-03-17T18:41:45Z"
        },
        "channel_context": [
          "in_app"
        ],
        "session_ref": "sess_456",
        "attributes": {
          "credit_score": 720,
          "prequalified": true
        }
      },
      "evaluation_hints": {
        "confidence_input": 0.72,
        "priority_model": "campaign_priority_v1",
        "review_recommended": false
      },
      "evidence": [
        {
          "type": "eligibility_snapshot",
          "ref": "elig_run_332"
        }
      ],
      "extensions": {
        "financial_services": {
          "offer_ref": "offer_refi_001",
          "member_tier": "gold"
        }
      }
    }
  ]
}

