{
  "intent_id": "550e8400-e29b-41d4-a716-446655440000",
  "schema_version": "1.0.0",
  "intent_type": "offer_decision",
  "created_at": "2026-03-17T18:42:00Z",
  "source": {
    "system": "manymoves",
    "source_ref": "mobile_offer_request",
    "correlation_id": "corr_789"
  },
  "objective": {
    "objective_id": "123e4567-e89b-12d3-a456-426614174000",
    "title": "Increase refinance conversions",
    "objective_type": "growth",
    "success_metric": "conversion_rate",
    "target": "+10%",
    "priority": 1,
    "time_horizon": "30d"
  },
  "actions": [
    {
      "action_id": "a987fbc9-4bed-3078-cf07-9141ba07c9f3",
      "action_type": "show_offer",
      "action_ref": "refi_offer_candidate_001",
      "channels": ["in_app", "email"],
      "priority_hint": 0.8,
      "justification": "Prequalified member with recent rate-check behavior"
    },
    {
      "action_id": "7d444840-9dc0-11d1-b245-5ffdce74fad2",
      "action_type": "suppress_offer",
      "action_ref": "credit_card_candidate_992",
      "channels": ["in_app", "email"],
      "priority_hint": 0.2,
      "justification": "Avoid conflicting credit message during refinance intent"
    }
  ],
  "constraints": [
    {
      "constraint_id": "7c9e6679-7425-40de-944b-e07fc1f90ae7",
      "type": "eligibility",
      "rule": "member_prequalified = true",
      "severity": "block",
      "scope": "action"
    },
    {
      "constraint_id": "16fd2706-8baf-433b-82eb-8c7fada847da",
      "type": "frequency",
      "rule": "no_duplicate_offer_within_7d",
      "severity": "block",
      "scope": "intent"
    },
    {
      "constraint_id": "d9428888-122b-11e1-b85c-61cd3cbb3210",
      "type": "compliance",
      "rule": "required_disclosure_present = true",
      "severity": "block",
      "scope": "action"
    }
  ],
  "context": {
    "customer_ref": "123",
    "segment_ref": "student_refi",
    "trigger": {
      "type": "mobile_login",
      "timestamp": "2026-03-17T18:41:45Z"
    },
    "channel_context": ["in_app"],
    "session_ref": "sess_456",
    "attributes": {
      "credit_score": 720,
      "prequalified": true,
      "recent_rate_check": true,
      "relationship_tenure_days": 420
    }
  },
  "evidence": [
    {
      "type": "eligibility_snapshot",
      "ref": "elig_run_332"
    },
    {
      "type": "campaign_policy",
      "ref": "policy_doc_19"
    }
  ],
  "extensions": {
    "financial_services": {
      "offer_ref": "offer_refi_001",
      "member_tier": "gold",
      "credit_union_id": "cu_7782"
    }
  }
}

